[
  {
    "app_id": "app_v7_1",
    "audit_ref": "audit://v7-1/small-studio",
    "created_at": "2026-06-08T08:17:19.742079+00:00",
    "limit_ref": "quota-policy://v7-1/default",
    "policy_decision": "allow",
    "quota_status_id": "quota-status://v7-1/default",
    "remaining": 42,
    "tenant_id": "tenant_v7_1",
    "workspace_id": "workspace_v7_1"
  },
  {
    "app_id": "app_v7_1",
    "audit_ref": "audit://v7-1/quota-denial",
    "created_at": "2026-06-08T08:17:19.742079+00:00",
    "limit_ref": "quota-policy://v7-1/monthly-provider-calls",
    "policy_decision": "deny",
    "quota_status_id": "quota-status://v7-1/denial-example",
    "remaining": 0,
    "tenant_id": "tenant_v7_1",
    "workspace_id": "workspace_v7_1"
  }
]
